<?xml version="1.0" encoding="UTF-8"?>
<SensorValues xmlns="http://www.teco.edu/SensorValuesSchema" xmlns:xsi="http://www.w3.org/2001/XMLSchema-instance" xsi:schemaLocation="http://www.teco.edu/SensorValuesSchema prs74.xsd ">
  <AcclX>
    <AcclValue>0</AcclValue>
    <AcclIdx>0</AcclIdx>
  </AcclX>
  <AcclY>
    <AcclValue>0</AcclValue>
    <AcclIdx>0</AcclIdx>
  </AcclY>
  <AcclZ>
    <AcclValue>0</AcclValue>
    <AcclIdx>0</AcclIdx>
  </AcclZ>
  <Audio>0</Audio>
  <Light>
    <LightValue>0</LightValue>
    <LightIdx>0</LightIdx>
  </Light>
  <AmbientLight>
    <LightValue>0</LightValue>
    <LightIdx>0</LightIdx>
  </AmbientLight>
  <Force>
    <ForceValue>0</ForceValue>
    <ForceIdx>0</ForceIdx>
  </Force>
  <Temperature>
    <TempValue>0</TempValue>
    <TempIdx>0</TempIdx>
  </Temperature>
  <Voltage>0</Voltage>
</SensorValues>
